{
  "image_id": "image",
  "diagram_type": "mechanical_plate",
  "holes": [
    {
      "hole_id": "hole-01",
      "center_xy": [
        180,
        225
      ],
      "diameter_px": 41.3,
      "circularity": 0.013,
      "bbox": [
        163,
        208,
        197,
        242
      ],
      "pixel_count": 973,
      "confidence": 0.9,
      "label_text": "D10",
      "label_confidence": 0.89,
      "primitive_ids": [
        "geometry.circle.hole-01",
        "geometry.text.hole-01"
      ]
    },
    {
      "hole_id": "hole-02",
      "center_xy": [
        300,
        225
      ],
      "diameter_px": 41.3,
      "circularity": 0.013,
      "bbox": [
        283,
        208,
        317,
        242
      ],
      "pixel_count": 973,
      "confidence": 0.9,
      "label_text": "D12",
      "label_confidence": 0.98,
      "primitive_ids": [
        "geometry.circle.hole-02",
        "geometry.text.hole-02"
      ]
    },
    {
      "hole_id": "hole-03",
      "center_xy": [
        420,
        225
      ],
      "diameter_px": 41.3,
      "circularity": 0.013,
      "bbox": [
        403,
        208,
        437,
        242
      ],
      "pixel_count": 973,
      "confidence": 0.9,
      "label_text": "D10",
      "label_confidence": 0.89,
      "primitive_ids": [
        "geometry.circle.hole-03",
        "geometry.text.hole-03"
      ]
    }
  ],
  "regions": [
    {
      "region_id": "plate",
      "kind": "plate",
      "bbox": [
        112,
        102,
        488,
        348
      ],
      "pixel_count": 88557,
      "confidence": 0.95,
      "primitive_ids": [
        "geometry.rectangle.plate"
      ]
    }
  ],
  "extraction_confidence": 0.9,
  "provenance": {
    "extractor_id": "geometry-v1",
    "extractor_version": "0.1.0",
    "backend": "component_circle",
    "metadata_source": "none",
    "dependency_versions": {},
    "environment": {}
  },
  "gaps": [],
  "metadata": {
    "image_path": "datasets\\mechanical\\geometry-v1-noisy\\mutated\\noisy-jpeg-mutated-01\\image.png"
  }
}